Application Location|Application Name|Application Size (Bytes)|Description|Developer Name|Downloads|Minimum SDK/OS Version|Price|Ratings - Average|Ratings - Total|Release Date|Supported Devices|Version|Version Release Date|Version Release Notes
Apple App Store|PNC BeneFit Plus|8645632|Save time and gain the insight you need to manage your Health Savings Account (HSA), Flexible Spending Account (FSA), Health Reimbursement Arrangement (HRA) or Qualified Transportation Account (QTA). Our secure app makes managing your tax-advantaged account(s) easy through quick access and intuitive navigation to all your important account information while you are on the go! This app is designed for your Apple device (including iPhone, iPad, and iPod touch ) version 6.0 and higher. Powerful features of the PNC BeneFit Plus app include: Easy, Convenient & Secure - Simply log in to the intuitive app to begin managing your account(s) quickly and easily - No sensitive account information is ever stored on your mobile device; secure encryption is used to protect all transmissions Connects You with the Details - Quickly check available balances 24/7, including investment balances for HSAs - Access account details - View charts summarizing your account(s) - Click to call or email PNC BeneFit Plus Customer Service with questions - View notifications and messages about your account Provides Additional Time-Saving Options - View claims requiring receipts - Submit medical FSA and HRA claims - Take a picture of a receipt and submit for a new or existing claim - View transaction details - Request HSA distributions - Make HSA contributions - Using Expense Tracker, enter medical expense information and supporting documentation to store for later use in paying claims online or for personal recordkeeping - Report your debit card as lost or stolen *This is not the PNC Mobile Banking app, which allows you to access your bank and brokerage accounts. For questions or support, call or email the PNC BeneFit Plus Customer Service Center at 844-356-9993 or pncbenefitplus@healthaccountservices.com No personal or sensitive data is stored on the PNC BeneFit Plus mobile app. PNC will deliver bug fixes and updates to the application from time to time. PNC does not charge a fee for this application. However, third party message and data rates may apply. A supported mobile device is needed to use the PNC BeneFit Plus Mobile App. Shares of mutual funds are not deposits or obligations or guaranteed endorsed by any bank, nor are they federally insured or otherwise supported by the Federal Deposit Insurance Corporate or other government agency. Investments in mutual funds may lose value, including possible loss of principal. Please read the prospectus carefully before you invest. Investments Not FDIC Insured. No Bank or Federal Government Guarantee. May lose value. PNC is a registered mark of The PNC Financial Services Group, Inc. (PNC). iPhone, iPad, and iPod touch are trademarks of Apple Inc., registered in the U.S. and other countries. Banking and lending products and services, bank deposit products, and treasury management services, including, but not limited to, services for clients and/or customers, are provided by PNC Bank, National Association, a wholly-owned subsidiary of PNC and Member FDIC. We are committed to protecting the privacy of your information. Please view our Privacy Policy for Consumers. 2015 The PNC Financial Services Group, Inc. All rights reserved.|PNC Bank, N.A.|N/A|6.0|0|N/A|N/A|2015-11-05T00:00:00+00:00|[u'iPhone3GS-iPhone-3GS', u'iPhone4-iPhone4', u'iPodTouchFourthGen-iPodTouchFourthGen', u'iPad2Wifi-iPad2Wifi', u'iPad23G-iPad23G', u'iPhone4S-iPhone4S', u'iPadThirdGen-iPadThirdGen', u'iPadThirdGen4G-iPadThirdGen4G', u'iPhone5-iPhone5', u'iPodTouchFifthGen-iPodTouchFifthGen', u'iPadFourthGen-iPadFourthGen', u'iPadFourthGen4G-iPadFourthGen4G', u'iPadMini-iPadMini', u'iPadMini4G-iPadMini4G', u'iPhone5c-iPhone5c', u'iPhone5s-iPhone5s', u'iPadAir-iPadAir', u'iPadAirCellular-iPadAirCellular', u'iPadMiniRetina-iPadMiniRetina', u'iPadMiniRetinaCellular-iPadMiniRetinaCellular', u'iPhone6-iPhone6', u'iPhone6Plus-iPhone6Plus', u'iPadAir2-iPadAir2', u'iPadAir2Cellular-iPadAir2Cellular', u'iPadMini3-iPadMini3', u'iPadMini3Cellular-iPadMini3Cellular', u'iPodTouchSixthGen-iPodTouchSixthGen', u'iPhone6s-iPhone6s', u'iPhone6sPlus-iPhone6sPlus', u'iPadMini4-iPadMini4', u'iPadMini4Cellular-iPadMini4Cellular', u'iPadPro-iPadPro', u'iPadProCellular-iPadProCellular', u'iPadPro97-iPadPro97', u'iPadPro97Cellular-iPadPro97Cellular', u'iPhoneSE-iPhoneSE', u'iPhone7-iPhone7', u'iPhone7Plus-iPhone7Plus']|4.5.0|2016-06-01T11:43:03+00:00|- Minor Fixes and Improvements - New 'Forgot Username and Password' functionality
Apple App Store|Deposit On-Site|49038336|DEPOSIT ON-SITE MOBILE for iPhone MOBILE DEPOSIT FOR CORPORATIONS ACCELERATE YOUR BUSINESS With PNC Banks corporate mobile solution, you have deposit-only access to accelerate your cash flow and include important payment details. In conjunction with PNCs Deposit On-Site service, this corporate mobile solution enables your companys mobile users to make check deposits on the go. For Companies interested in using PNCs Deposit On-Site Mobile Deposit Service, contact your Treasury Management Officer or visit pnc.com/treasury. MOBILE USERS: The PNC Deposit On-Site Mobile App provides an efficient way to accelerate the deposit of consumer and business checks. This app is designed for Apple iPhone devices with an operating system of iOS 7 and higher. With a supported iPhone mobile device, you can: Download and launch the PNC Deposit On-Site Mobile App. Authenticate and sign on with the Operator ID and Password supplied by your company. Create a new deposit for one or more checks, take a picture of the check(s), enter the dollar amount, and enter data related to the payments received. Submit your deposit to PNC via your mobile device, several times a day or at the end of your business day. View open and submitted deposit details from your mobile device. For Deposit On-Site Mobile support call 1-800-669-1518 or tmcc@pnc.com. PNC does not charge a fee for this application. However, third party message and data rates may apply. A supported mobile device is needed to use the Deposit On-Site Mobile App. Your employer has previously entered into a Treasury Management Services Comprehensive Agreement with PNC Bank, National Association (PNC Bank) regarding your and your employers use of the Deposit On-Site service (the Comprehensive Agreement). The terms and conditions of the Comprehensive Agreement shall govern your access to and use of the mobile version of the Deposit On-Site Mobile service (the App) via an Apple mobile device. PNC and Deposit On-Site are registered marks of The PNC Financial Services Group, Inc. (PNC). Apple and iPhone are trademarks of Apple Inc., registered in the U.S. and other countries. Bank deposit, treasury management products and services are provided by PNC Bank, National Association, a wholly-owned subsidiary of PNC and Member FDIC. 2015 The PNC Financial Services Group, Inc. All rights reserved.|PNC Bank, N.A.|N/A|6.0|0|N/A|N/A|2016-01-21T00:00:00+00:00|[u'iPhone3GS-iPhone-3GS', u'iPhone4-iPhone4', u'iPodTouchFourthGen-iPodTouchFourthGen', u'iPad2Wifi-iPad2Wifi', u'iPad23G-iPad23G', u'iPhone4S-iPhone4S', u'iPadThirdGen-iPadThirdGen', u'iPadThirdGen4G-iPadThirdGen4G', u'iPhone5-iPhone5', u'iPodTouchFifthGen-iPodTouchFifthGen', u'iPadFourthGen-iPadFourthGen', u'iPadFourthGen4G-iPadFourthGen4G', u'iPadMini-iPadMini', u'iPadMini4G-iPadMini4G', u'iPhone5c-iPhone5c', u'iPhone5s-iPhone5s', u'iPadAir-iPadAir', u'iPadAirCellular-iPadAirCellular', u'iPadMiniRetina-iPadMiniRetina', u'iPadMiniRetinaCellular-iPadMiniRetinaCellular', u'iPhone6-iPhone6', u'iPhone6Plus-iPhone6Plus', u'iPadAir2-iPadAir2', u'iPadAir2Cellular-iPadAir2Cellular', u'iPadMini3-iPadMini3', u'iPadMini3Cellular-iPadMini3Cellular', u'iPodTouchSixthGen-iPodTouchSixthGen', u'iPhone6s-iPhone6s', u'iPhone6sPlus-iPhone6sPlus', u'iPadMini4-iPadMini4', u'iPadMini4Cellular-iPadMini4Cellular', u'iPadPro-iPadPro', u'iPadProCellular-iPadProCellular', u'iPadPro97-iPadPro97', u'iPadPro97Cellular-iPadPro97Cellular', u'iPhoneSE-iPhoneSE', u'iPhone7-iPhone7', u'iPhone7Plus-iPhone7Plus']|1.1.018|2016-01-21T19:29:10+00:00|
Apple App Store|PINACLE for iPhone|93218816|PINACLE for iPhone Get 24/7 access to PINACLE, PNC Banks corporate online and mobile banking portal. The PINACLE Mobile App is a service offered exclusively to all PINACLE and PINACLE Express operators. There is no separate fee for the app. FEATURES APPROVE and DECISION ITEMS Approve wire transfers or templates, ACH batches or templates, and operator passwords, and review Positive Pay exceptions and ACH Positive Pay suspects. VIEW BALANCES and TRANSACTION DETAILS View Current Day and Previous Day account balances and transactions, or drill down into individual account details from your dashboard. INITIATE PAYMENTS Initiate real-time account transfers, repetitive wire transfers, ACH batches from templates, and review daily activity for all three payment types in the Manage Payments feature. SEARCH FOR TRANSACTIONS and IMAGES Conduct a search for individual transactions or a range of transactions; view transaction details including images (when available). VIEW REAL-TIME CREDIT INFORMATION and RECENT TRANSACTIONS View details of commitments, loans and letters of credit, including availability, balances, maturity dates/rates, and recent transaction history. MANAGE OPERATOR ACCESS Change and approve operator passwords, unlock operators, clear operator sessions and prompt re-enrollment of security questions. NOTIFICATIONS View Event Notifications, System Alerts and Informational Messages to keep informed of business activities. SECURITY Authentication credentials for the app are the same as what you use for the PINACLE desktop application. Additionally, the PINACLE Mobile App provides enhanced detection and security controls specific to device utilization in a mobile network environment. Conveniently access PINACLE with your fingerprint instead of your login credentials when using Touch ID authentication. Simply activate this feature using 'Preferences' within the app. Your PINACLE Company ID must be enabled for this feature, and a token passcode is still required, where applicable. To get started, download and launch the app. Then log in with your existing PINACLE Company User ID, Operator ID, password and token passcode (if required). Its that simple! Follow us on Twitter @PNC_PINACLE for the latest PINACLE news and updates. For PINACLE questions or support, call Treasury Management Client Care at 1-800-669-1518 or tmcc@pnc.com PNC does not charge a fee for this application. However, third party message and data rates may apply. A supported mobile device is needed to use the PINACLE Mobile App. Certain other restrictions may apply. See the PINACLE Service Agreement. iPhone is a trademark of Apple Inc., registered in the U.S. and other countries. PNC and PINACLE are registered marks of The PNC Financial Services Group, Inc. (PNC). Bank deposit, treasury management products and services are provided by PNC Bank, National Association, a wholly-owned subsidiary of PNC and Member FDIC. 2016 The PNC Financial Services Group, Inc. All rights reserved.|PNC Bank, N.A.|N/A|5.1.1|0|N/A|N/A|2014-05-17T23:00:00+00:00|[u'iPhone3GS-iPhone-3GS', u'iPadWifi-iPadWifi', u'iPad3G-iPad3G', u'iPodTouchThirdGen-iPodTouchThirdGen', u'iPhone4-iPhone4', u'iPodTouchFourthGen-iPodTouchFourthGen', u'iPad2Wifi-iPad2Wifi', u'iPad23G-iPad23G', u'iPhone4S-iPhone4S', u'iPadThirdGen-iPadThirdGen', u'iPadThirdGen4G-iPadThirdGen4G', u'iPhone5-iPhone5', u'iPodTouchFifthGen-iPodTouchFifthGen', u'iPadFourthGen-iPadFourthGen', u'iPadFourthGen4G-iPadFourthGen4G', u'iPadMini-iPadMini', u'iPadMini4G-iPadMini4G', u'iPhone5c-iPhone5c', u'iPhone5s-iPhone5s', u'iPadAir-iPadAir', u'iPadAirCellular-iPadAirCellular', u'iPadMiniRetina-iPadMiniRetina', u'iPadMiniRetinaCellular-iPadMiniRetinaCellular', u'iPhone6-iPhone6', u'iPhone6Plus-iPhone6Plus', u'iPadAir2-iPadAir2', u'iPadAir2Cellular-iPadAir2Cellular', u'iPadMini3-iPadMini3', u'iPadMini3Cellular-iPadMini3Cellular', u'iPodTouchSixthGen-iPodTouchSixthGen', u'iPhone6s-iPhone6s', u'iPhone6sPlus-iPhone6sPlus', u'iPadMini4-iPadMini4', u'iPadMini4Cellular-iPadMini4Cellular', u'iPadPro-iPadPro', u'iPadProCellular-iPadProCellular', u'iPadPro97-iPadPro97', u'iPadPro97Cellular-iPadPro97Cellular', u'iPhoneSE-iPhoneSE', u'iPhone7-iPhone7', u'iPhone7Plus-iPhone7Plus']|1.8.1|2016-12-30T14:43:51+00:00|- Minor Fixes and Improvements
Apple App Store|Total Insight|33128448|PNC Total Insight from PNC Total Insight Management was built to let you see where you stand at a glance, or quickly drill down into the details that matter most. All to help you achieve more with your money. With the PNC Total Insight mobile app you can keep track of your PNC Investment accounts on the go. Be sure to download the Virtual Wallet mobile app to keep track of your bank accounts. App Features: - Review your mobile Brief summary - Customize views with the My PNC Folio tool - View asset allocation - Keep track of your income and cash flow - Monitor your portfolio performance - Review recent transactions - Track your net worth - Quickly and easily contact PNC Total Insight Customer Care|PNC Bank, N.A.|N/A|8.0|0|N/A|N/A|2014-04-15T23:00:00+00:00|[u'iPad2Wifi-iPad2Wifi', u'iPad23G-iPad23G', u'iPhone4S-iPhone4S', u'iPadThirdGen-iPadThirdGen', u'iPadThirdGen4G-iPadThirdGen4G', u'iPhone5-iPhone5', u'iPodTouchFifthGen-iPodTouchFifthGen', u'iPadFourthGen-iPadFourthGen', u'iPadFourthGen4G-iPadFourthGen4G', u'iPadMini-iPadMini', u'iPadMini4G-iPadMini4G', u'iPhone5c-iPhone5c', u'iPhone5s-iPhone5s', u'iPadAir-iPadAir', u'iPadAirCellular-iPadAirCellular', u'iPadMiniRetina-iPadMiniRetina', u'iPadMiniRetinaCellular-iPadMiniRetinaCellular', u'iPhone6-iPhone6', u'iPhone6Plus-iPhone6Plus', u'iPadAir2-iPadAir2', u'iPadAir2Cellular-iPadAir2Cellular', u'iPadMini3-iPadMini3', u'iPadMini3Cellular-iPadMini3Cellular', u'iPodTouchSixthGen-iPodTouchSixthGen', u'iPhone6s-iPhone6s', u'iPhone6sPlus-iPhone6sPlus', u'iPadMini4-iPadMini4', u'iPadMini4Cellular-iPadMini4Cellular', u'iPadPro-iPadPro', u'iPadProCellular-iPadProCellular', u'iPadPro97-iPadPro97', u'iPadPro97Cellular-iPadPro97Cellular', u'iPhoneSE-iPhoneSE', u'iPhone7-iPhone7', u'iPhone7Plus-iPhone7Plus']|1.2.2|2015-10-27T14:02:31+00:00|Total Insight has been updated to include the following: -Minor Fixes and Improvements
Apple App Store|DepositNow Mobile for Business|4093952|Making a deposit is as easy as snapping a picture on your mobile device. Using the PNC DepositNow Mobile App on supported devices, you can deposit checks to your business accounts. This app may be especially useful for customers who receive a small number of checks for deposit. Upon deposit review and approval to use this solution, the daily deposit limits will be set to meet the individual needs of the business. All deposits made up to 10 P.M. ET will receive same day credit. For more information contact our Support group at : 877-287-2654, Option 4.|PNC Bank, N.A.|N/A|5.1.1|0|N/A|N/A|2013-10-30T00:00:00+00:00|[u'iPhone3GS-iPhone-3GS', u'iPadWifi-iPadWifi', u'iPad3G-iPad3G', u'iPodTouchThirdGen-iPodTouchThirdGen', u'iPhone4-iPhone4', u'iPodTouchFourthGen-iPodTouchFourthGen', u'iPad2Wifi-iPad2Wifi', u'iPad23G-iPad23G', u'iPhone4S-iPhone4S', u'iPadThirdGen-iPadThirdGen', u'iPadThirdGen4G-iPadThirdGen4G', u'iPhone5-iPhone5', u'iPodTouchFifthGen-iPodTouchFifthGen', u'iPadFourthGen-iPadFourthGen', u'iPadFourthGen4G-iPadFourthGen4G', u'iPadMini-iPadMini', u'iPadMini4G-iPadMini4G', u'iPhone5c-iPhone5c', u'iPhone5s-iPhone5s', u'iPadAir-iPadAir', u'iPadAirCellular-iPadAirCellular', u'iPadMiniRetina-iPadMiniRetina', u'iPadMiniRetinaCellular-iPadMiniRetinaCellular', u'iPhone6-iPhone6', u'iPhone6Plus-iPhone6Plus', u'iPadAir2-iPadAir2', u'iPadAir2Cellular-iPadAir2Cellular', u'iPadMini3-iPadMini3', u'iPadMini3Cellular-iPadMini3Cellular', u'iPodTouchSixthGen-iPodTouchSixthGen', u'iPhone6s-iPhone6s', u'iPhone6sPlus-iPhone6sPlus', u'iPadMini4-iPadMini4', u'iPadMini4Cellular-iPadMini4Cellular', u'iPadPro-iPadPro', u'iPadProCellular-iPadProCellular', u'iPadPro97-iPadPro97', u'iPadPro97Cellular-iPadPro97Cellular', u'iPhoneSE-iPhoneSE', u'iPhone7-iPhone7', u'iPhone7Plus-iPhone7Plus']|1.6|2016-06-15T12:42:23+00:00|- Improved for iPhone 6 compatibility - Updated design
Google Play Store|PNC Mobile|18874368|Now get 24/7 access to PNC Bank account information and services from your Android Device. PNC Mobile Banking is a free service offered to all PNC Online Banking customers. CHECK BALANCES - See current account balances for your checking, savings, and credit card accounts. MOBILE DEPOSIT- Use your camera equipped Android device with autofocus to deposit checks. VIEW TRANSACTIONS - View recent transaction history in your checking, savings, or credit card accounts and search for specific transactions by date, amount, or check number. PAY BILLS - Make one-time bill payments to billers you have entered in PNC Online Banking. TRANSFER FUNDS - Transfer funds between your eligible PNC banking accounts. LOCATE PNC - Locate the nearest PNC Bank Branch or ATM using zip code or street address. SECURITY - With PNC's Security Assurance, you can be confident that your personal and financial information will be protected while using PNC Mobile Banking. For installation support, call: 1-800-762-2035 For general support, call: 1-800-PNC-BANK (762-2265) PNC does not charge a fee for mobile banking. However, third party message and data rates may apply. A supported mobile device is needed to use the Mobile Banking App. Use of the Mobile Deposit feature requires a supported camera-equipped device. An eligible PNC Bank account and PNC Bank Online Banking are required. Certain other restrictions apply. See the PNC Online Banking Service Agreement.|PNC Bank, N.A.|1,000,000 - 5,000,000|2.2 and up||4.0349879264832|50503|2012-04-24T17:03:07+00:00|N/A|3.0.1.61|2016-07-11T23:00:00+00:00|- Minor Fixes and Improvements
Google Play Store|Virtual Wallet by PNC|20971520|Now get Virtual Wallet on-the-go with your Android device. Virtual Wallet by PNC is a free App for all PNC Virtual Wallet customers. FEATURES MAIN At-a-glance view of Money Bar, the upcoming week and your last five transactions. MOBILE DEPOSIT - Use your camera equipped Android device to deposit checks using automatic image capture. Now it's even easier to deposit checks using the PNC Virtual Wallet app. When using Mobile Deposit, position your check within the on-screen guides and allow the app to capture the check image automatically. TRANSFER FUNDS - Slide the Money Bar to transfer funds between your Spend and Reserve accounts. Use Transfer Funds to move funds between the Spend, Reserve, and Growth accounts. CALENDAR - View your scheduled payments and transfers, transaction history, paydays, reserve items, and Danger Days. PAY BILLS - Make one-time bill payments to billers you have already set up online using Virtual Wallet. ACTIVITIES - View recent transaction history in your Virtual Wallet accounts and search for specific transactions by date, amount, or check number. LOCATE PNC - Locate the nearest PNC Bank Branch or ATM using built-in Location Services or search by zip code and street address. RESERVE ITEMS View items and use Buy Now option to transfer from your Reserve account to your Spend account. SECURITY - With PNCs Security Assurance, you can be confident that your personal and financial information will be protected while using the Virtual Wallet App. Follow us on Twitter @PNCVWallet for the latest Virtual Wallet updates. For mobile banking support, call 1-800-762-2035 For general support, call 1-800-PNC-BANK (762-2265) PNC does not charge a fee for mobile banking. However, third party message and data rates may apply. A supported mobile device is needed to use the Mobile Banking App. Use of the Mobile Deposit feature requires a supported camera-equipped device. An eligible PNC Bank account and PNC Bank Online Banking are required. Certain other restrictions apply. See the PNC Online Banking Service Agreement. PNC may use certain technologies to collect additional information related to the status and condition of your mobile devices. This information may be used to support the security of your transaction with PNC, determine industry trends, and for other research purposes.|PNC Bank, N.A.|1,000,000 - 5,000,000|4.1 and up||3.5885629653931|10055|2011-11-27T13:52:51+00:00|N/A|3.5.1|2016-10-25T23:00:00+00:00|- Check Deposit Now Includes Automatic Image Capture Now its even easier to deposit checks using the PNC Mobile Banking app. When using Mobile Deposit, position your check within the on-screen guides and allow the app to capture the check image automatically. - Minor Fixes and Improvements
Google Play Store|PNC SmartAccess Card|9646899|**PLEASE NOTE, IF YOU ARE INSTALLING VER 1.0 OF THE NEW SmartAccess APP FOR THE FIRST TIME YOU WILL NEED TO CREATE A NEW USER ID AND PASSWORD.** With the PNC SmartAccessPrepaid Visa Card mobile app from PNC Bank, This application is free to download and makes it easy for you to bank on the go! Once youve created a secure passcode for logging on, youll have access to: *View balance *View transaction history *Suspend or reactivate cards *Manage alerts *Request balance information via text message Your security is our priority. Mobile data transmissions and card information are protected by 128-bit encryption, just like they are when you bank online. Experience the freedom of mobile banking in the palm of your hands! IMPORTANT: During the enrollment process, please do not close out of this application while awaiting the activation code. It will appear as an SMS/text message within 2 minutes and then must be entered into the application to complete your enrollment. PNC SmartAccess is a registered trademark of The PNC Financial Services Group, Inc. VISA is a registered trademark of Visa International Service Association and used under license. 2016 The PNC Financial Services Group, Inc. All rights reserved. PNC Bank, National Association. Member FDIC|PNC Bank, N.A.|10,000 - 50,000|4.1 and up||2.0246913433075|486|2016-06-12T23:00:00+00:00|N/A|1.0.0|2016-06-12T23:00:00+00:00|N/A
Google Play Store|Virtual Wallet tablet by PNC|9542041|Now get Virtual Wallet on your Android tablet. Virtual Wallet by PNC is a free App for all PNC Virtual Wallet customers. Our Android tablet app is optimized for the Android tablet experience, with larger graphics and more functionality. FEATURES QUICK VIEW At-a-glance view of Money Bar, the upcoming week, what you spent last week and your last five transactions CALENDAR - View your scheduled payments and transfers, transaction history, paydays, reserve items, and Danger Days in Month and Day View. ACCOUNT DETAIL View scheduled payments, reserve and wish list items. Slide the Money Bar to transfer funds between your Spend and Reserve accounts. Use Transfer Funds to move funds between your Spend, Reserve, and Growth accounts. ACCOUNT ACTIVITY - View transaction history in your Spend, Reserve and Growth accounts as well as a linked Credit Card. MOBILE DEPOSIT- Use your camera equipped Android device to deposit checks. PAY BILLS - Make one-time and recurring bill payments to billers you have already set up online using Virtual Wallet. SOCIAL INTEGRATION View the latest Facebook posts, Tweets and YouTube videos from the Virtual Wallet team LOCATE PNC - Locate the nearest PNC Bank Branch or ATM using built-in Location Services or search by zip code and street address. SECURITY - With PNCs Security Assurance, you can be confident that your personal and financial information will be protected while using the Virtual Wallet App. Follow us on Twitter @PNCVWallet for the latest Virtual Wallet updates. Tweet us @PNCVirtualWallet_Help for help with your Virtual Wallet service needs. For mobile banking support, call 1-800-762-2035 For general support, call 1-800-PNC-BANK (762-2265) PNC does not charge a fee for mobile banking. However, third party message and data rates may apply. A supported mobile device is needed to use the Mobile Banking App. Use of the Mobile Deposit feature requires a supported camera-equipped device. An eligible PNC Bank account and PNC Bank Online Banking are required. Certain other restrictions apply. See the PNC Online Banking Service Agreement.|PNC Bank, N.A.|10,000 - 50,000|2.0 and up||2.4513514041901|370|2012-08-24T04:21:19+00:00|N/A|1.6.1|2015-02-23T00:00:00+00:00|Minor Enhancements
